,slokas_no,slokas,slokas_english(NO NUMBERS),slokas_english
0,1.0,सञ्जय उवाचतं तथा कृपयाविष्टमश्रुपूर्णाकुलेक्षणम् ।विषीदन्तमिदं वाक्यमुवाच मधुसूदनः ॥ १ ॥,Sanjaya addressed him who was thus overwhelmed with tears and his eyes filled with tears and spoke these words to him in depression   ,Sanjaya addressed him who was thus overwhelmed with tears and his eyes filled with tears and spoke these words to him in depression 1  
1,2.0,श्री भगवानुवाचकुतस्त्वा कश्मलमिदं विषमे समुपस्थितम् ।अनार्यजुष्टमस्वर्ग्यकीर्तिकरमर्जुन ॥ २ ॥,"The Supreme Personality of Godhead said: O Arjuna, where is this fatigue of You? O Arjuna, the ignorant and the unemployed by the ignorant and the reputation of heavenly reputation.   ","The Supreme Personality of Godhead said: O Arjuna, where is this fatigue of You? O Arjuna, the ignorant and the unemployed by the ignorant and the reputation of heavenly reputation. 2  "
2,3.0,क्ल‍ैब्यं मा स्म गमः पार्थ नैतत्त्वय्युपपद्यते ।क्षुद्रं हृदयदौर्बल्यं त्यक्त्वोत्तिष्ठ परन्तप ॥ ३ ॥,"O son of Pṛthā, do not become absorbed in this world. O Arjuna, give up the weakness of the heart and the weakness of the heart.   ","O son of Pṛthā, do not become absorbed in this world. O Arjuna, give up the weakness of the heart and the weakness of the heart. 3  "
3,4.0,अर्जुन उवाचकथं भीष्ममहं संख्ये द्रोणं च मधुसूदन ।इषुभिः प्रतियोत्स्यामि पूजार्हावरिसूदन ॥ ४ ॥,"Arjuna said: O destroyer of Madhu, O destroyer of the gods, how can I fight with arrows at Bhīṣma and Drona in battle? .","Arjuna said: O destroyer of Madhu, O destroyer of the gods, how can I fight with arrows at Bhīṣma and Drona in battle? 4."
4,5.0,गुरूनहत्वा हि महानुभावान्श्रेयो भोक्तुं भैक्ष्यमपीह लोके ।हत्वार्थकामांस्तु गुरूनिहैवभुज्ज‍ीय भोगान्‍रुधिरप्रदिग्धान् ॥ ५ ॥,"In this world, in this world, one should enjoy the pleasures of almsgiving and enjoying the pleasures of the spiritual master.   ","In this world, in this world, one should enjoy the pleasures of almsgiving and enjoying the pleasures of the spiritual master. 5  "
5,6.0,न चैतद्विद्मः कतरन्नो गरीयोयद्वा जयेम यदि वा नो जयेयुः ।यानेव हत्वा न जिजीविषाम-स्तेऽवस्थिताः प्रमुखे धार्तराष्ट्राः ॥ ६ ॥,"We do not know which of us is better than us, whether we shall conquer us or we shall conquer us.   ","We do not know which of us is better than us, whether we shall conquer us or we shall conquer us. 6  "
6,7.0,कार्पण्यदोषोपहतस्वभावःपृच्छामि त्वां धर्मसम्मूढचेताः ।यच्छ्रेयः स्यान्निश्‍चितं ब्रूहि तन्मेशिष्यस्तेऽहं शाधि मां त्वां प्रपन्नम् ॥ ७ ॥,I inquire of the evils of the evils of carnation I ask you with my mind confused with religious principles   ,I inquire of the evils of the evils of carnation I ask you with my mind confused with religious principles 7  
7,8.0,न हि प्रपश्यामि ममापनुद्याद् -यच्छोकमुच्छोषणमिन्द्रियाणाम् ।अवाप्य भूभावसपत्‍नमृद्धंराज्यं सुराणामपि चाधिपत्यम् ॥ ८ ॥,"I do not see any pain that I have absorbed in the senses, and I shall not find myself in the kingdom of the earth, which is the kingdom of the demigods.   ","I do not see any pain that I have absorbed in the senses, and I shall not find myself in the kingdom of the earth, which is the kingdom of the demigods. 8  "
8,9.0,सञ्जय उवाचएवमुक्त्वा हृषीकेशं गुडाकेशः परन्तपः ।न योत्स्य इति गोविन्दामुक्त्वा तूष्णीं बभूव ह ॥ ९ ॥,"Sanjaya said: Having said this, Gudakesha, the tormentor of enemies, said to him, “You will not fight,” said Govinda, “I will not fight.” .","Sanjaya said: Having said this, Gudakesha, the tormentor of enemies, said to him, “You will not fight,” said Govinda, “I will not fight.” 9."
9,10.0,तमुवाच हृषीकेशः प्रहसन्निव भारत ।सेनयोरूभयोर्मध्ये विषीदन्तमिदं वचः ॥ १० ॥,O descendant of Bharata the sage Hrishikesha replied to him as if laughing in the midst of the two armies .,O descendant of Bharata the sage Hrishikesha replied to him as if laughing in the midst of the two armies 10.
10,11.0,श्री भगवानुवाचअशोच्यनन्वशोचस्त्वं प्रज्ञावादांश्च भाषसे ।गतासूनगतासूंश्च नानुशोचन्ति पण्डिताः ॥ ११ ॥,The Supreme Personality of Godhead said: You are speaking without grieve for the sake of regrets and do not regret the words of intelligence. .,The Supreme Personality of Godhead said: You are speaking without grieve for the sake of regrets and do not regret the words of intelligence. 11.
11,12.0,न त्वेवाहं जातु नासं न त्वं नेमे जनाधिपाः ।न चैव नभविष्यामः सर्वे वयमतः परम् ॥ १२ ॥,"I have never been, nor are you, nor these rulers of men, nor shall we not be any other.   ","I have never been, nor are you, nor these rulers of men, nor shall we not be any other. 12  "
12,13.0,देहिनोऽस्मिन्यथा देहे कौमारं यौवनं जरा ।तथा देहान्तरप्राप्तिर्धीरस्तत्र न मुह्यति ॥ १३ ॥,"Otherwise, in this body, in the body, youth, youth, old age and old age are not deluded by the steadfastness of the body.   ","Otherwise, in this body, in the body, youth, youth, old age and old age are not deluded by the steadfastness of the body. 13  "
13,14.0,मात्रास्पर्शास्तु कौन्तेय शीतोष्णसुखदुःखदाः ।आगमापायिनोऽनित्यास्तांस्तितिक्षस्व भारत ॥ १४ ॥,"O son of Kunti, O son of Kunti, please bear with them, O Arjuna, and they are eternal, sick, sick and deprived.   ","O son of Kunti, O son of Kunti, please bear with them, O Arjuna, and they are eternal, sick, sick and deprived. 14  "
14,15.0,यं हि न व्यथयन्त्येते पुरुषं पुरुषर्षभ ।समदुःखसुखं धीरं सोऽमृतत्वाय कल्पते ॥ १५ ॥,"O best of men, when these men are not disturbed, O best of men, the steadfast and pleasures of the Supreme Personality of Godhead are equally painful for their immortality.   ","O best of men, when these men are not disturbed, O best of men, the steadfast and pleasures of the Supreme Personality of Godhead are equally painful for their immortality. 15  "
15,16.0,नासतो विद्यते भावो नाभावो विद्यते सतः ।उभयोरपि दृष्टोऽन्तस्त्वनयोस्तत्त्वदर्शिभिः ॥ १६ ॥,There is no being in the unreal and there is no absence of being.   ,There is no being in the unreal and there is no absence of being. 16  
16,17.0,अविनाशि तु तद्विद्धि येन सर्वमिदं ततम् ।विनाशमव्ययस्यास्य न कश्चित्कर्तुमर्हति ॥ १७ ॥,Know that this is the indestructible one by which all this is pervaded and no one can do this inexhaustible destruction. .,Know that this is the indestructible one by which all this is pervaded and no one can do this inexhaustible destruction. 17.
17,18.0,अन्तवन्त इमे देहा नित्यस्योक्ताः शरीरिणः ।अनाशिनोऽप्रमेयस्य तस्माद्युध्यस्व भारत ॥ १८ ॥,"These bodies are eternally described as the embodied beings of the embodied beings. Therefore, O descendant of Bharata, please fight the indestructible and immeasurable ones.   ","These bodies are eternally described as the embodied beings of the embodied beings. Therefore, O descendant of Bharata, please fight the indestructible and immeasurable ones. 18  "
18,19.0,य एनं वेत्ति हन्तारं यश्चैनं मन्यते हतम् ।उभौ तौ न विजानीतो नायं हन्ति न हन्यते ॥ १९ ॥,He who knows this is the killer and he who thinks that he is killed He does not know that he is not killed nor is he killed .,He who knows this is the killer and he who thinks that he is killed He does not know that he is not killed nor is he killed 19.
19,20.0,न जायते म्रियते वा कदाचि-न्नायं भूत्वा भविता वा न भूयः ।अजो नित्यः शाश्वतोऽयं पुराणोन हन्यते हन्यमाने शरीरे ॥ २० ॥,"He is never born or dies, nor will he ever be born, nor will he ever be unborn, eternal, eternal, nor ever killed by the body. When his body is killed, he is not killed.   ","He is never born or dies, nor will he ever be born, nor will he ever be unborn, eternal, eternal, nor ever killed by the body. When his body is killed, he is not killed. 20  "
20,21.0,वेदाविनाशिनं नित्यं य एनमजमव्ययम् ।कथं स पुरुषः पार्थ कं घातयति हन्ति कम् ॥ २१ ॥,O son of Pṛthā how does one kill this unborn and inexhaustible one who is eternally indestructible in the Vedas? Whom does he kill?   ,O son of Pṛthā how does one kill this unborn and inexhaustible one who is eternally indestructible in the Vedas? Whom does he kill? 21  
21,22.0,वासांसि जीर्णानि यथा विहायनवानि गृह्णाति नरोऽपराणि ।तथा शरीराणि विहाय जीर्णा-न्यन्यानि संयाति नवानि देही ॥ २२ ॥,"Just as a man takes old clothes and wore new ones, he leaves his body and puts away his old bodies.   ","Just as a man takes old clothes and wore new ones, he leaves his body and puts away his old bodies. 22  "
22,23.0,नैनं छिन्दन्ति शस्त्राणि नैनं दहति पावकः ।न चैनं क्ल‍ेदयन्त्यापो न शोषयति मारुतः ॥ २३ ॥,The weapons do not cut it nor the fire burns it nor the wind nor the dry waters nor dried it   ,The weapons do not cut it nor the fire burns it nor the wind nor the dry waters nor dried it 23  
23,24.0,अच्छेद्योऽयमदाह्योऽयमक्ल‍ेद्योऽशोष्य एव च ।नित्यः सर्वगतः स्थाणुरचलोऽयं सनातनः ॥ २४ ॥,This is the inseparable one who is to be cut and burned and is not burnt and dried and is eternally omnipresent and eternal   ,This is the inseparable one who is to be cut and burned and is not burnt and dried and is eternally omnipresent and eternal 24  
24,25.0,अव्यक्तोऽयमचिन्त्योऽयमविकार्योऽयमुच्यते ।तस्मादेवं विदित्वैनं नानुशोचितुमर्हसि ॥ २५ ॥,"This unmanifest, unchanging, unchanging and unchanging person should not regret this. .","This unmanifest, unchanging, unchanging and unchanging person should not regret this. 25."
25,26.0,अथ चैनं नित्यजातं नित्यं वा मन्यसे मृतम् ।तथापि त्वं महाबाहो नैनं शोचितुमर्हसि ॥ २६ ॥,"O mighty-armed one, you should think that he is eternally born or eternally dead, yet you should not grieve for him. .","O mighty-armed one, you should think that he is eternally born or eternally dead, yet you should not grieve for him. 26."
26,27.0,जातस्य हि ध्रुवो मृत्युर्ध्रुवं जन्म मृतस्य च ।तस्मादपरिहार्येऽर्थे न त्वं शोचितुमर्हसि ॥ २७ ॥,Death is certain for one who is born and that one who is dead is certainly dead.   ,Death is certain for one who is born and that one who is dead is certainly dead. 27  
27,28.0,अव्यक्तादीनि भूतानि व्यक्तमध्यानि भारत ।अव्यक्तनिधनान्येव तत्र का परिदेवना ॥ २८ ॥,"O descendant of Bharata, what is the regret for the unmanifest, the unmanifest, the unmanifest deaths? .","O descendant of Bharata, what is the regret for the unmanifest, the unmanifest, the unmanifest deaths? 28."
28,29.0,आश्चर्यवत्पश्यति कश्चिदेन -माश्चर्यवद्वदति तथैव चान्यः ।आश्चर्यवच्च‍ैनमन्यः श‍ृणोतिश्रुत्वाप्येनं वेद न चैव कश्चित् ॥ २९ ॥,Someone else sees him as a wonder and speaks astonishingly in the same way while another hears him as a wonder and no one knows it even after hearing it .,Someone else sees him as a wonder and speaks astonishingly in the same way while another hears him as a wonder and no one knows it even after hearing it 29.
29,30.0,देही नित्यमवध्योऽयं देहे सर्वस्य भारत ।तस्मात्सर्वाणि भूतानि न त्वं शोचितुमर्हसि ॥ ३० ॥,"O descendant of Bharata, the embodied soul is always invincible to the body. Therefore, O descendant of Bharata, you should not grieve for all living beings. .","O descendant of Bharata, the embodied soul is always invincible to the body. Therefore, O descendant of Bharata, you should not grieve for all living beings. 30."
30,31.0,स्वधर्ममपि चावेक्ष्य न विकम्पितुमर्हसि ।धर्म्याद्धि युद्धाच्छ्रेयोऽन्यत्क्षत्रियस्य न विद्यते ॥ ३१ ॥,You should not be shaken by your own religious duties. There is nothing better for a kshatriya than warfare.   ,You should not be shaken by your own religious duties. There is nothing better for a kshatriya than warfare. 31  
31,32.0,यदृच्छया चोपपन्नं स्वर्गद्वारमपावृतम् ।सुखिनः क्षत्रियाः पार्थ लभन्ते युद्धमीदृशम् ॥ ३२ ॥,O Arjuna the happy kshatriyas who were happy to have covered the gate of heaven by chance and enjoy such a battle   ,O Arjuna the happy kshatriyas who were happy to have covered the gate of heaven by chance and enjoy such a battle 32  
32,33.0,अथ चेत्त्वमिमं धर्म्यं सङ्ग्रामं न करिष्यसि ।ततः स्वधर्मं कीर्तिं च हित्वा पापमवाप्स्यसि ॥ ३३ ॥,If you do not fight this righteous battle you will then give up your religious duties and fame and incur sin .,If you do not fight this righteous battle you will then give up your religious duties and fame and incur sin 33.
33,34.0,अकीर्तिं चापि भूतानि कथयिष्यन्ति तेऽव्ययाम् ।सम्भावितस्य चाकीर्तिर्मरणादतिरिच्यते ॥ ३४ ॥,"If you are unable to repute in the universe, you will tell you about the unfavorable things that you can do so.   ","If you are unable to repute in the universe, you will tell you about the unfavorable things that you can do so. 34  "
34,35.0,भयाद्रणादुपरतं मंस्यन्ते त्वां महारथाः ।येषां च त्वं बहुमतो भूत्वा यास्यसि लाघवम् ॥ ३५ ॥,The great charioteers will think you will be leaving you in fear and you will go lightly and go lightly .,The great charioteers will think you will be leaving you in fear and you will go lightly and go lightly 35.
35,36.0,अवाच्यवादांश्च बहून्वदिष्यन्ति तवाहिताः ।निन्दन्तस्तव सामर्थ्य ततो दुःखतरं नु किम् ॥ ३६ ॥,They will speak many inexpressible arguments and you will tell you what your strength is more painful than you .,They will speak many inexpressible arguments and you will tell you what your strength is more painful than you 36.
36,37.0,हतो वा प्राप्स्यसि स्वर्ग जित्वा वा भोक्ष्यसे महीम् ।तस्मादुत्तिष्ठ कौन्तेय युद्धाय कृतनिश्चयः ॥ ३७ ॥,"Whether you have been killed you will attain heaven or conquer you and enjoy the earth therefore O son of Kunti, you have determined to fight for battle. .","Whether you have been killed you will attain heaven or conquer you and enjoy the earth therefore O son of Kunti, you have determined to fight for battle. 37."
37,38.0,सुखदुःखे समे कृत्वा लाभालाभौ जयाजयौ ।ततो युद्धाय युज्यस्व नैवं पापमवाप्स्यसि ॥ ३८ ॥,"Equal to happiness and pain, profit and loss, victory and defeat, then engage in battle, and you will not incur sin. .","Equal to happiness and pain, profit and loss, victory and defeat, then engage in battle, and you will not incur sin. 38."
38,39.0,एषा तेऽभिहिता सांख्ये बुद्धिर्योगे त्विमां श‍ृणु ।बुद्ध्या युक्तो यया पार्थ कर्मबन्धं प्रहास्यसि ॥ ३९ ॥,"O son of Pṛthā, please hear this intelligence described to you in the Sāṅkhya Yoga. By which you will give up the bondage of your actions. .","O son of Pṛthā, please hear this intelligence described to you in the Sāṅkhya Yoga. By which you will give up the bondage of your actions. 39."
39,40.0,नेहाभिक्रमनाशोऽस्ति प्रत्यवायो न विद्यते ।स्वल्पमप्यस्य धर्मस्य त्रायते महतो भयात् ॥ ४० ॥,There is no responsibility in this world and there is no response to this world. Even a little bit of religious principles saves from great fear.   ,There is no responsibility in this world and there is no response to this world. Even a little bit of religious principles saves from great fear. 40  
40,41.0,व्यवसायात्मिका बुद्धिरेकेह कुरूनन्दन ।बहुशाखा ह्यनन्ताश्च बुद्धयोऽव्यवसायिनाम् ॥ ४१ ॥,O son of the Kurus alone the intelligence is the intellect which is the source of all business and is of infinite intelligence .,O son of the Kurus alone the intelligence is the intellect which is the source of all business and is of infinite intelligence 41.
41,42.0,यामिमां पुष्पितां वाचं प्रवदन्त्यविपश्चितः ।वेदवादरताः पार्थ नान्यदस्तीति वादिनः ॥ ४२ ॥,"The words of the Vedas, O son of Pṛthā, are the words of the Supreme Personality of Godhead, O son of Pṛthā.","The words of the Vedas, O son of Pṛthā, are the words of the Supreme Personality of Godhead, O son of Pṛthā. 42 They are desirous of desire and bestows the fruits of their births and actions 43."
42,43.0,कामात्मानः स्वर्गपरा जन्मकर्मफलप्रदाम् ।क्रियाविशेषबहुलां भोगैश्वर्यगतिं प्रति ॥ ४३ ॥,They are desirous of desire and bestows the fruits of their births and actions,
43,44.0,भोगैश्वर्यप्रसक्तानां तयापहृतचेतसाम् ।व्यवसायात्मिका बुद्धिः समाधौ न विधीयते ॥ ४४ ॥,Those who are attached to pleasures and opulence and who have abducted the minds of these things are not fixed in meditation.   ,Those who are attached to pleasures and opulence and who have abducted the minds of these things are not fixed in meditation. 44  
44,45.0,त्रैगुण्यविषया वेदा निस्त्रैगुण्यो भवार्जुन ।निर्द्वन्द्वो नित्यसत्त्वस्थो निर्योगक्षेम आत्मवान् ॥ ४५ ॥,"O Arjuna, the Vedas are free from all material contamination and are free from all material modes of material nature. .","O Arjuna, the Vedas are free from all material contamination and are free from all material modes of material nature. 45."
45,46.0,यावानर्थ उदपाने सर्वतः सम्प्लुतोदके ।तावान्सर्वेषु वेदेषु ब्राह्मणस्य विजानतः ॥ ४६ ॥,As many of the brāhmaṇas in all the Vedas when the waters of the river are flooded with water in the waters of the Vedas .,As many of the brāhmaṇas in all the Vedas when the waters of the river are flooded with water in the waters of the Vedas 46.
46,47.0,कर्मण्येवाधिकारस्ते मा फलेषु कदाचन ।मा कर्मफलहेतुर्भूर्मा ते सङ्गोऽस्त्वकर्मणि ॥ ४७ ॥,"You have only the right to perform your duties, never to the fruits of your actions. Do not be the cause of the fruits of your actions, nor let your attachment be to inaction. .","You have only the right to perform your duties, never to the fruits of your actions. Do not be the cause of the fruits of your actions, nor let your attachment be to inaction. 47."
47,48.0,योगस्थः कुरु कर्माणि सङ्गं त्यक्त्वा धनञ्जय ।सिद्ध्यसिद्ध्योः समो भूत्वा समत्वं योग उच्यते ॥ ४८ ॥,O Arjuna one should perform his duties in yoga and perform his duties as equal to perfection in perfection and perfection   ,O Arjuna one should perform his duties in yoga and perform his duties as equal to perfection in perfection and perfection 48  
48,49.0,दूरेण ह्यवरं कर्म बुद्धियोगाद्धनञ्जय ।बुद्धौ शरणमन्विच्छ कृपणाः फलहेतवः ॥ ४९ ॥,"O Arjuna, by the practice of intelligence and by the practice of intelligence, please take refuge in your intelligence and for the sake of rewards. .","O Arjuna, by the practice of intelligence and by the practice of intelligence, please take refuge in your intelligence and for the sake of rewards. 49."
