,slokas_no,slokas,slokas_english(NO NUMBERS),slokas_english
49,50.0,बुद्धियुक्तो जहातीह उभे सुकृतदुष्कृते ।तस्माद्योगाय युज्यस्व योगः कर्मसु कौशलम् ॥ ५० ॥,"A person who is endowed with intelligence gives up both good and bad deeds in this world. Therefore, engage in yoga for yoga, for yoga.   ","A person who is endowed with intelligence gives up both good and bad deeds in this world. Therefore, engage in yoga for yoga, for yoga. 50  "
50,51.0,कर्मजं बुद्धियुक्ता हि फलं त्यक्त्वा मनीषिणः ।जन्मबन्धविनिर्मुक्ताः पदं गच्छन्त्यनामयम् ॥ ५१ ॥,Those who are endowed with intelligence and who are free from the fruits of their actions and who are freed from the bondage of birth and death go to the abode of health   ,Those who are endowed with intelligence and who are free from the fruits of their actions and who are freed from the bondage of birth and death go to the abode of health 51  
51,52.0,यदा ते मोहकलिलं बुद्धिर्व्यतितरिष्यति ।तदा गन्तासि निर्वेदं श्रोतव्यस्य श्रुतस्य च ॥ ५२ ॥,When your intelligence is overwhelmed by the stain of delusion you will attain to detachment from what you have heard and what you have heard   ,When your intelligence is overwhelmed by the stain of delusion you will attain to detachment from what you have heard and what you have heard 52  
52,53.0,श्रुतिविप्रतिपन्ना ते यदा स्थास्यति निश्चला ।समाधावचला बुद्धिस्तदा योगमवाप्स्यसि ॥ ५३ ॥,"When you are contradicted by the Vedas, you will remain unmoved and unsteady in meditation, then you will attain to yoga.   ","When you are contradicted by the Vedas, you will remain unmoved and unsteady in meditation, then you will attain to yoga. 53  "
53,54.0,अर्जुन उवाचस्थितप्रज्ञस्य का भाषा समाधिस्थस्य केशव ।स्थितधीः किं प्रभाषेत किमासीत व्रजेत किम् ॥ ५४ ॥,"Arjuna said: O Keśava, what is the language of a person who is in trance? What is the use of a steady mind? .","Arjuna said: O Keśava, what is the language of a person who is in trance? What is the use of a steady mind? 54."
54,55.0,श्रीभगवानुवाचप्रजहाति यदा कामान्सर्वान्पार्थ मनोगतान् ।आत्मन्येवात्मना तुष्टः स्थितप्रज्ञस्तदोच्यते ॥ ५५ ॥,"The Supreme Personality of Godhead said: When the Supreme Personality of Godhead, O son of the earth, is satisfied with the self, the mind is satisfied with the self-realized soul. .","The Supreme Personality of Godhead said: When the Supreme Personality of Godhead, O son of the earth, is satisfied with the self, the mind is satisfied with the self-realized soul. 55."
55,56.0,दुःखेष्वनुद्विग्न‍मनाः सुखेषु विगतस्पृहः ।वीतरागभयक्रोधः स्थिधीर्मुनिरुच्यते ॥ ५६ ॥,A sage is called a sage who is free from attachment to pleasures and who is free from attachment to pleasures   ,A sage is called a sage who is free from attachment to pleasures and who is free from attachment to pleasures 56  
56,57.0,यः सर्वत्रानभिस्नेहस्तत्तत्प्राप्य श‍ुभाश‍ुभम् ।नाभिनन्दति न द्वेष्टि तस्य प्रज्ञा प्रतिष्ठिता ॥ ५७ ॥,A person who does not feel affection for him who is not attached to it does not rejoice or hate or hate his intelligence   ,A person who does not feel affection for him who is not attached to it does not rejoice or hate or hate his intelligence 57  
57,58.0,यदा संहरते चायं कूर्मोऽङ्गानीव सर्वशः ।इन्द्रियाणीन्द्रियार्थेभ्यस्तस्य प्रज्ञा प्रतिष्ठिता ॥ ५८ ॥,When this tortoise withdraws the limbs of the body in every way the senses are fixed in the sense objects of the senses   ,When this tortoise withdraws the limbs of the body in every way the senses are fixed in the sense objects of the senses 58  
58,59.0,विषया विनिवर्तन्ते निराहारस्य देहिनः ।रसवर्जं रसोऽप्यस्य परं दृष्ट्वा निवर्तते ॥ ५९ ॥,When the embodied beings are ceased by the food of the body the senses are withdrawn and the taste is avoided by seeing the other   ,When the embodied beings are ceased by the food of the body the senses are withdrawn and the taste is avoided by seeing the other 59  
59,60.0,यततो ह्यपि कौन्तेय पुरुषस्य विपश्चितः ।इन्द्रियाणि प्रमाथीनि हरन्ति प्रसभं मनः ॥ ६० ॥,"O son of Kunti, the wise man, who is also aware of the senses, strikes the minds of the Supreme Personality of Godhead. .","O son of Kunti, the wise man, who is also aware of the senses, strikes the minds of the Supreme Personality of Godhead. 60."
60,61.0,तानि सर्वाणि संयम्य युक्त आसीत मत्परः ।वशे हि यस्येन्द्रियाणि तस्य प्रज्ञा प्रतिष्ठिता ॥ ६१ ॥,Having restrained all these things he should be steadfast and devoted to Me. He whose senses are under his control is established in his intelligence.   ,Having restrained all these things he should be steadfast and devoted to Me. He whose senses are under his control is established in his intelligence. 61  
61,62.0,ध्यायतो विषयान्पुंसः सङ्गस्तेषूपजायते ।सङ्गात्सञ्जायते कामः कामात्क्रोधोऽभिजायते ॥ ६२ ॥,A man who meditates on objects is born of attachment to them and lust arises from attachment to lust and anger is born of lust .,A man who meditates on objects is born of attachment to them and lust arises from attachment to lust and anger is born of lust 62.
62,63.0,क्रोधाद्भ‍वति सम्मोहः सम्मोहात्स्मृतिविभ्रमः ।स्मृतिभ्रंशाद्बुद्धिनाशो बुद्धिनाशात्प्रणश्यति ॥ ६३ ॥,In anger there is delusion and delusion is the illusion of memory and the destruction of intelligence is destroyed by the loss of intelligence. .,In anger there is delusion and delusion is the illusion of memory and the destruction of intelligence is destroyed by the loss of intelligence. 63.
63,64.0,रागद्वेषविमुक्तैस्तु विषयनिन्द्रियैश्चरन् ।आत्मवश्यैर्विधेयात्मा प्रसादमधिगच्छति ॥ ६४ ॥,"One who is freed from attachment and hatred, moves about in sense gratification, attains the mercy of the Supreme Personality of Godhead.   ","One who is freed from attachment and hatred, moves about in sense gratification, attains the mercy of the Supreme Personality of Godhead. 64  "
64,65.0,प्रसादे सर्वदुःखानां हानिरस्योपजायते ।प्रसन्नचेतसो ह्याश‍ु बुद्धिः पर्यवतिष्ठते ॥ ६५ ॥,"When the mind is merciful to all sufferings, the intelligence of a person with a happy mind is relieved. .","When the mind is merciful to all sufferings, the intelligence of a person with a happy mind is relieved. 65."
65,66.0,नास्ति बुद्धिरयुक्तस्य न चायुक्तस्य भावना ।न चाभावयतः शान्तिरशान्तस्य कुतः सुखम् ॥ ६६ ॥,There is no intelligence for the steadfast nor for the steadfast and the mind is not meditated upon by the peaceful one who is unsettled .,There is no intelligence for the steadfast nor for the steadfast and the mind is not meditated upon by the peaceful one who is unsettled 66.
66,67.0,इन्द्रियाणां हि चरतां यन्मनोऽनुविधीयते ।तदस्य हरति प्रज्ञां वायुर्नावमिवाम्भसि ॥ ६७ ॥,"When the mind is moving about in the senses, the mind takes away the intelligence of the living entity, just as the wind takes away his intelligence in the water. .","When the mind is moving about in the senses, the mind takes away the intelligence of the living entity, just as the wind takes away his intelligence in the water. 67."
67,68.0,तस्माद्यस्य महाबाहो निगृहीतानि सर्वशः ।इन्द्रियाणीन्द्रियार्थेभ्यस्तस्य प्रज्ञा प्रतिष्ठिता ॥ ६८ ॥,"Therefore, O mighty-armed one, whose intelligence is established in all respects, the senses, the senses and the objects of the senses are established.   ","Therefore, O mighty-armed one, whose intelligence is established in all respects, the senses, the senses and the objects of the senses are established. 68  "
68,69.0,या निशा सर्वभूतानां तस्यां जागर्ति संयमी ।यस्यां जाग्रति भूतानि सा निशा पश्यतो मुनेः ॥ ६९ ॥,The night in which all living entities are awake is the self-realized soul in which all living beings are awake and that night is the night of the sage. .,The night in which all living entities are awake is the self-realized soul in which all living beings are awake and that night is the night of the sage. 69.
69,70.0,आपूर्यमाणमचलप्रतिष्ठंसमुद्रमापः प्रविशन्ति यद्वत् ।तद्वत्कामा यं प्रविशन्ति सर्वेस शान्तिमाप्‍नोति न कामकामी ॥ ७० ॥,"Just as the waters of the ocean enter into the unchanging state of being filled with the unchanging state of the Supreme Personality of Godhead, they enter into the state of peace, but they are all peaceful, not the lustful one.   ","Just as the waters of the ocean enter into the unchanging state of being filled with the unchanging state of the Supreme Personality of Godhead, they enter into the state of peace, but they are all peaceful, not the lustful one. 70  "
70,71.0,विहाय कामान्यः सर्वान्पुमांश्चरति निःस्पृहः ।निर्ममो निरहङ्कार स शान्तिमधिगच्छति ॥ ७१ ॥,A man who gives up all his desires moves about and moves about without desire and who is free from egoism and who is free from egoism attains peace   ,A man who gives up all his desires moves about and moves about without desire and who is free from egoism and who is free from egoism attains peace 71  
71,72.0,एषा ब्राह्मी स्थितिःपार्थ नैनां प्राप्य विमुह्यति ।स्थित्वास्यामन्तकालेऽपि ब्रह्मनिर्वाणमृच्छति ॥ ७२ ॥,"This is the position of the Supreme Personality of Godhead, O Arjuna, and when one attains this state of being, one attains to the state of transcendental bliss even at the end of the day. .","This is the position of the Supreme Personality of Godhead, O Arjuna, and when one attains this state of being, one attains to the state of transcendental bliss even at the end of the day. 72."
